{"attempt":{"exhausted":false,"max_total":7,"number":1},"duration_ms":2,"exit_code":0,"id":"verify-be7cf05fc886658fe42778653d783733f5c68d43c0bea61b4c6047c32e2ac79c","profile":"demo-static","schema_version":"0.3.0","stages":[{"cost_class":"static","detail":"demo mode - static tiers only","duration_ms":1,"id":"write-guard","verdict":"pass"},{"cost_class":"static","detail":"demo mode - static tiers only","duration_ms":1,"id":"ui-groups","verdict":"pass"}],"started_at":"2026-08-08T23:48:06Z","target":"demo mode verify stub","verdict":"pass"}