{"attempt":{"exhausted":false,"max_total":7,"number":1},"duration_ms":2,"exit_code":1,"failed_stage":"unit","feedback":{"details":"Verifier detected a regression by adding a failing edge-case test.","locations":[{"file":"AppTests\/Graph\/VerifierEdgeCaseTests.swift","line":1,"message":"Expected edge case to pass."}],"summary":"Edge-case unit test failed against integration diff"},"id":"verify-ea3f875d68c3751db57b23bf2c47d017241adedf9560c269b6bad83c0bbc9036","profile":"demo-verifier-unit-only","schema_version":"0.3.0","stages":[{"cost_class":"unit","counts":{"failed":1,"passed":0,"skipped":0,"tests_run":1},"detail":"demo mode - verifier stub unit-only","duration_ms":1,"id":"unit","verdict":"fail"}],"started_at":"2026-08-08T23:48:08Z","target":"demo mode verify stub","verdict":"fail"}